{
  "id": "doc-d4e5f6",
  "turn_id": "turn-d4e5f6",
  "revision": 1,
  "evidence_version": "outcome-card-01",
  "section": {
    "type": "card",
    "kind": "film",
    "name": "Bramble Moon",
    "year": 2024,
    "director": "Quill Arden",
    "genres": ["adventure", "family"],
    "source_id": "src-d4e5f6"
  },
  "sources": [
    {
      "id": "src-d4e5f6",
      "kind": "wikipedia",
      "title": "Bramble Moon",
      "url": "https://example.com/bramble-moon",
      "site": "example.com",
      "snippet": "A 2024 adventure film directed by Quill Arden.",
      "source": "turn-d4e5f6",
      "created_at": "2026-09-16T12:05:00Z",
      "hlc": "1778976300000:0:hub001"
    }
  ],
  "provenance": "composer:turn-d4e5f6:typed-card",
  "created_at": "2026-09-16T12:05:01Z",
  "hlc": "1778976301000:0:hub001"
}
